{
  "$schema": "./schemas/package-manifest.schema.json",
  "schema_version": "1.0",
  "skill_id": "long-horizon-engineering",
  "default_profile": "local-governance-core",
  "profiles": {
    "legacy-full": {
      "components": [
        "core",
        "bundled-optional"
      ],
      "separate_skills": [
        "ai-video-production"
      ]
    },
    "core-only": {
      "components": [
        "core"
      ],
      "separate_skills": []
    },
    "local-governance-core": {
      "components": [
        "core"
      ],
      "separate_skills": []
    },
    "lhe-bundled": {
      "components": [
        "core",
        "bundled-optional"
      ],
      "separate_skills": []
    }
  },
  "components": {
    "core": {
      "layer": "core",
      "required": true,
      "paths": [
        ".agents/skills/long-horizon-engineering/SKILL.md",
        ".agents/skills/long-horizon-engineering/catalog/local-capability-catalog.json",
        ".agents/skills/long-horizon-engineering/package-manifest.json",
        ".agents/skills/long-horizon-engineering/references/approved-tool-contract-card.md",
        ".agents/skills/long-horizon-engineering/references/capability-boundaries.md",
        ".agents/skills/long-horizon-engineering/references/client-privacy.md",
        ".agents/skills/long-horizon-engineering/references/code-review-response-protocol.md",
        ".agents/skills/long-horizon-engineering/references/context-compaction.md",
        ".agents/skills/long-horizon-engineering/references/decision-log.md",
        ".agents/skills/long-horizon-engineering/references/large-migration-playbook.md",
        ".agents/skills/long-horizon-engineering/references/planner-builder-evaluator-loop.md",
        ".agents/skills/long-horizon-engineering/references/protocol.md",
        ".agents/skills/long-horizon-engineering/references/resume-protocol.md",
        ".agents/skills/long-horizon-engineering/references/runtime-safety-envelope.md",
        ".agents/skills/long-horizon-engineering/references/review-checklist.md",
        ".agents/skills/long-horizon-engineering/references/safety-policy.md",
        ".agents/skills/long-horizon-engineering/references/security-review-protocol.md",
        ".agents/skills/long-horizon-engineering/references/security-authority-chain.md",
        ".agents/skills/long-horizon-engineering/references/token-accountability.md",
        ".agents/skills/long-horizon-engineering/references/self-check-policy.md",
        ".agents/skills/long-horizon-engineering/references/ship-readiness-protocol.md",
        ".agents/skills/long-horizon-engineering/references/skill-routing-and-promotion-contract.md",
        ".agents/skills/long-horizon-engineering/references/stop-conditions.md",
        ".agents/skills/long-horizon-engineering/references/systematic-debugging-protocol.md",
        ".agents/skills/long-horizon-engineering/references/validation-matrix.md",
        ".agents/skills/long-horizon-engineering/schemas/package-manifest.schema.json",
        ".agents/skills/long-horizon-engineering/schemas/skill-routing-decision.schema.json",
        ".agents/skills/long-horizon-engineering/scripts/audit_skill_descriptions.py",
        ".agents/skills/long-horizon-engineering/scripts/local_compute_deployment.py",
        ".agents/skills/long-horizon-engineering/scripts/local_compute_pool.py",
        ".agents/skills/long-horizon-engineering/scripts/runtime_safety_envelope.py",
        ".agents/skills/long-horizon-engineering/scripts/security_authority_chain.py",
        ".agents/skills/long-horizon-engineering/scripts/token_accountability.py",
        ".agents/skills/long-horizon-engineering/scripts/audit_skill_safety.py",
        ".agents/skills/long-horizon-engineering/scripts/check_skill_package.py",
        ".agents/skills/long-horizon-engineering/scripts/doctor.py",
        ".agents/skills/long-horizon-engineering/scripts/selfcheck_installed_skill.py",
        ".agents/skills/long-horizon-engineering/scripts/test_expected_triggers.py",
        ".agents/skills/long-horizon-engineering/scripts/update_installed_skill.py",
        ".agents/skills/long-horizon-engineering/templates/APPROVED_TOOL_CONTRACT_CARD.md",
        ".agents/skills/long-horizon-engineering/templates/HANDOFF_REPORT_TEMPLATE.md",
        ".agents/skills/long-horizon-engineering/templates/LOCAL_GOVERNANCE_WORK_PACKET.md",
        ".agents/skills/long-horizon-engineering/templates/TASK_LOG_TEMPLATE.md",
        ".agents/skills/long-horizon-engineering/templates/WORKING_STATE_TEMPLATE.md",
        ".agents/skills/long-horizon-engineering/templates/debugging-runbook.md",
        ".agents/skills/long-horizon-engineering/templates/implementation-plan.md",
        ".agents/skills/long-horizon-engineering/templates/regression-test-record.md",
        ".agents/skills/long-horizon-engineering/templates/reviewer-response.md",
        ".agents/skills/long-horizon-engineering/templates/risk-disclosure.md",
        ".agents/skills/long-horizon-engineering/templates/safe-skill-update-selfcheck.md",
        ".agents/skills/long-horizon-engineering/templates/ship-checklist.md",
        ".agents/skills/long-horizon-engineering/templates/verification-evidence.md"
      ]
    },
    "bundled-optional": {
      "layer": "bundled-optional",
      "required": false,
      "paths": [
        ".agents/skills/long-horizon-engineering/prompt-styles/concise.md",
        ".agents/skills/long-horizon-engineering/prompt-styles/evidence-first.md",
        ".agents/skills/long-horizon-engineering/prompt-styles/product-review.md",
        ".agents/skills/long-horizon-engineering/references/adversarial-review-protocol.md",
        ".agents/skills/long-horizon-engineering/references/api-integration-protocol.md",
        ".agents/skills/long-horizon-engineering/references/continuous-improvement.md",
        ".agents/skills/long-horizon-engineering/references/data-cleaning-protocol.md",
        ".agents/skills/long-horizon-engineering/references/decision-map-and-frontier.md",
        ".agents/skills/long-horizon-engineering/references/disaster-monitoring-enablement.md",
        ".agents/skills/long-horizon-engineering/references/evidence-backed-writing.md",
        ".agents/skills/long-horizon-engineering/references/explicit-only-extensions.md",
        ".agents/skills/long-horizon-engineering/references/external-app-runtime-boundary.md",
        ".agents/skills/long-horizon-engineering/references/external-search-protocol.md",
        ".agents/skills/long-horizon-engineering/references/external-skill-adoption-safety-review.md",
        ".agents/skills/long-horizon-engineering/references/external-source-scan.md",
        ".agents/skills/long-horizon-engineering/references/external-tool-provider-protocol.md",
        ".agents/skills/long-horizon-engineering/references/financial-research-report-protocol.md",
        ".agents/skills/long-horizon-engineering/references/investment-research-agent-protocol.md",
        ".agents/skills/long-horizon-engineering/references/ideation-to-plan-protocol.md",
        ".agents/skills/long-horizon-engineering/references/industrial-skill-design-principles.md",
        ".agents/skills/long-horizon-engineering/references/jurisdiction-industry-compliance.md",
        ".agents/skills/long-horizon-engineering/references/local-compute-capability-intake.md",
        ".agents/skills/long-horizon-engineering/references/local-voice-tool-sandbox.md",
        ".agents/skills/long-horizon-engineering/references/multi-perspective-financial-research.contract.json",
        ".agents/skills/long-horizon-engineering/references/multi-perspective-financial-research.md",
        ".agents/skills/long-horizon-engineering/references/missing-capability-skill-discovery.md",
        ".agents/skills/long-horizon-engineering/references/notebook-analysis-protocol.md",
        ".agents/skills/long-horizon-engineering/references/obsidian-knowledge-workflow.md",
        ".agents/skills/long-horizon-engineering/references/personal-workflow-review.md",
        ".agents/skills/long-horizon-engineering/references/presentation-delivery-protocol.md",
        ".agents/skills/long-horizon-engineering/references/public-agent-capability-review.md",
        ".agents/skills/long-horizon-engineering/references/repomix-codebase-context.md",
        ".agents/skills/long-horizon-engineering/references/safe-project-context-map.md",
        ".agents/skills/long-horizon-engineering/references/skill-authoring-methodology.md",
        ".agents/skills/long-horizon-engineering/references/skill-lifecycle-management.md",
        ".agents/skills/long-horizon-engineering/references/skill-optimization-protocol.md",
        ".agents/skills/long-horizon-engineering/references/skillopt-training-layer.md",
        ".agents/skills/long-horizon-engineering/references/tdd-protocol.md",
        ".agents/skills/long-horizon-engineering/references/three-d-asset-provider-sandbox.md",
        ".agents/skills/long-horizon-engineering/references/ui-design-skill-adapter.md",
        ".agents/skills/long-horizon-engineering/references/ui-ux-review-protocol.md",
        ".agents/skills/long-horizon-engineering/references/upgrade-audit-protocol.md",
        ".agents/skills/long-horizon-engineering/references/usage-and-trigger-review.md",
        ".agents/skills/long-horizon-engineering/references/writing-humanization-protocol.md",
        ".agents/skills/long-horizon-engineering/schemas/decision-map.schema.json",
        ".agents/skills/long-horizon-engineering/schemas/frontier.schema.json",
        ".agents/skills/long-horizon-engineering/scripts/append_project_memory.py",
        ".agents/skills/long-horizon-engineering/scripts/audit_external_skill_candidate.py",
        ".agents/skills/long-horizon-engineering/scripts/check_for_updates.py",
        ".agents/skills/long-horizon-engineering/scripts/compute_frontier.py",
        ".agents/skills/long-horizon-engineering/scripts/github_skill_scan.py",